{
    "input_path": "image.png",
    "page_index": null,
    "model_settings": {
        "use_doc_preprocessor": false,
        "use_textline_orientation": false
    },
    "dt_polys": [
        [
            [
                33,
                4
            ],
            [
                311,
                6
            ],
            [
                311,
                27
            ],
            [
                33,
                25
            ]
        ],
        [
            [
                3722,
                6
            ],
            [
                3743,
                6
            ],
            [
                3743,
                27
            ],
            [
                3722,
                27
            ]
        ],
        [
            [
                3791,
                4
            ],
            [
                3815,
                4
            ],
            [
                3815,
                27
            ],
            [
                3791,
                27
            ]
        ],
        [
            [
                103,
                106
            ],
            [
                203,
                108
            ],
            [
                203,
                130
            ],
            [
                103,
                128
            ]
        ],
        [
            [
                10,
                139
            ],
            [
                38,
                139
            ],
            [
                38,
                165
            ],
            [
                10,
                165
            ]
        ],
        [
            [
                102,
                148
            ],
            [
                308,
                148
            ],
            [
                308,
                172
            ],
            [
                102,
                172
            ]
        ],
        [
            [
                102,
                171
            ],
            [
                347,
                171
            ],
            [
                347,
                191
            ],
            [
                102,
                191
            ]
        ],
        [
            [
                3650,
                163
            ],
            [
                3760,
                163
            ],
            [
                3760,
                184
            ],
            [
                3650,
                184
            ]
        ],
        [
            [
                103,
                191
            ],
            [
                164,
                191
            ],
            [
                164,
                201
            ],
            [
                103,
                201
            ]
        ],
        [
            [
                98,
                214
            ],
            [
                140,
                214
            ],
            [
                140,
                238
            ],
            [
                98,
                238
            ]
        ],
        [
            [
                1282,
                258
            ],
            [
                1529,
                270
            ],
            [
                1526,
                340
            ],
            [
                1278,
                328
            ]
        ],
        [
            [
                1018,
                275
            ],
            [
                1103,
                277
            ],
            [
                1102,
                302
            ],
            [
                1018,
                300
            ]
        ],
        [
            [
                1590,
                281
            ],
            [
                1740,
                289
            ],
            [
                1737,
                355
            ],
            [
                1587,
                347
            ]
        ],
        [
            [
                495,
                295
            ],
            [
                520,
                295
            ],
            [
                520,
                357
            ],
            [
                495,
                357
            ]
        ],
        [
            [
                631,
                301
            ],
            [
                651,
                301
            ],
            [
                651,
                337
            ],
            [
                631,
                337
            ]
        ],
        [
            [
                787,
                299
            ],
            [
                807,
                299
            ],
            [
                807,
                336
            ],
            [
                787,
                336
            ]
        ],
        [
            [
                3686,
                320
            ],
            [
                3723,
                320
            ],
            [
                3723,
                343
            ],
            [
                3686,
                343
            ]
        ],
        [
            [
                1004,
                333
            ],
            [
                1099,
                333
            ],
            [
                1099,
                354
            ],
            [
                1004,
                354
            ]
        ],
        [
            [
                72,
                375
            ],
            [
                99,
                375
            ],
            [
                99,
                424
            ],
            [
                72,
                424
            ]
        ],
        [
            [
                1003,
                369
            ],
            [
                1068,
                369
            ],
            [
                1068,
                391
            ],
            [
                1003,
                391
            ]
        ],
        [
            [
                3636,
                374
            ],
            [
                3776,
                374
            ],
            [
                3776,
                394
            ],
            [
                3636,
                394
            ]
        ],
        [
            [
                821,
                399
            ],
            [
                847,
                401
            ],
            [
                844,
                464
            ],
            [
                818,
                462
            ]
        ],
        [
            [
                596,
                410
            ],
            [
                619,
                411
            ],
            [
                617,
                469
            ],
            [
                594,
                468
            ]
        ],
        [
            [
                1001,
                430
            ],
            [
                1086,
                432
            ],
            [
                1085,
                456
            ],
            [
                1001,
                454
            ]
        ],
        [
            [
                3585,
                422
            ],
            [
                3643,
                422
            ],
            [
                3643,
                444
            ],
            [
                3585,
                444
            ]
        ],
        [
            [
                3657,
                422
            ],
            [
                3717,
                422
            ],
            [
                3717,
                443
            ],
            [
                3657,
                443
            ]
        ],
        [
            [
                3718,
                422
            ],
            [
                3775,
                422
            ],
            [
                3775,
                444
            ],
            [
                3718,
                444
            ]
        ],
        [
            [
                3786,
                421
            ],
            [
                3825,
                421
            ],
            [
                3825,
                444
            ],
            [
                3786,
                444
            ]
        ],
        [
            [
                3595,
                456
            ],
            [
                3653,
                460
            ],
            [
                3652,
                483
            ],
            [
                3594,
                479
            ]
        ],
        [
            [
                1005,
                471
            ],
            [
                1104,
                471
            ],
            [
                1104,
                490
            ],
            [
                1005,
                490
            ]
        ],
        [
            [
                3808,
                463
            ],
            [
                3819,
                463
            ],
            [
                3819,
                473
            ],
            [
                3808,
                473
            ]
        ],
        [
            [
                3624,
                498
            ],
            [
                3686,
                498
            ],
            [
                3686,
                524
            ],
            [
                3624,
                524
            ]
        ],
        [
            [
                1003,
                533
            ],
            [
                1071,
                533
            ],
            [